{
  "$schema": "https://json-schema.org/draft/2020-12/schema",
  "$id": "https://oyzu.example.invalid/schemas/v1alpha1/manifest.schema.json",
  "title": "Oyzu manifest draft v1alpha1",
  "type": "object",
  "properties": {
    "schemaVersion": {
      "const": "v1alpha1"
    },
    "kind": {
      "const": "build-manifest"
    },
    "runId": {
      "type": "string",
      "pattern": "^[A-Za-z0-9][A-Za-z0-9_.:/-]{0,255}$"
    },
    "planDigest": {
      "anyOf": [
        {
          "type": "string",
          "pattern": "^sha256:[0-9a-f]{64}$"
        },
        {
          "type": "null"
        }
      ]
    },
    "planPath": {
      "anyOf": [
        {
          "type": "string",
          "pattern": "^(?!/)(?!.*(?:^|/)\\.\\.(?:/|$))(?!.*[\\\\:])[^\\x00-\\x1f]+$"
        },
        {
          "type": "null"
        }
      ]
    },
    "status": {
      "enum": [
        "succeeded",
        "failed",
        "cancelled",
        "interrupted"
      ]
    },
    "source": {
      "anyOf": [
        {
          "$ref": "#/$defs/source"
        },
        {
          "type": "null"
        }
      ]
    },
    "targets": {
      "type": "array",
      "items": {
        "$ref": "#/$defs/target"
      },
      "minItems": 0
    },
    "actions": {
      "type": "array",
      "items": {
        "type": "object",
        "properties": {
          "id": {
            "type": "string",
            "pattern": "^[A-Za-z0-9][A-Za-z0-9_.:/-]{0,255}$"
          },
          "target": {
            "type": "string",
            "pattern": "^[A-Za-z0-9][A-Za-z0-9_.:/-]{0,255}$"
          },
          "status": {
            "enum": [
              "succeeded",
              "cached",
              "failed",
              "cancelled",
              "blocked",
              "skipped"
            ]
          },
          "actionKey": {
            "type": "string",
            "pattern": "^sha256:[0-9a-f]{64}$"
          },
          "exitCode": {
            "type": "integer"
          },
          "reason": {
            "type": "string",
            "minLength": 1
          },
          "producerEvidence": {
            "type": "array",
            "items": {
              "type": "string",
              "pattern": "^[A-Za-z0-9][A-Za-z0-9_.:/-]{0,255}$"
            },
            "minItems": 0
          },
          "enforced": {
            "type": "array",
            "items": {
              "type": "string",
              "minLength": 1
            },
            "minItems": 0
          },
          "required": {
            "type": "boolean"
          },
          "durationMs": {
            "type": "integer",
            "minimum": 0,
            "maximum": 9007199254740991
          },
          "attempt": {
            "type": "integer",
            "minimum": 1,
            "maximum": 9007199254740991
          }
        },
        "required": [
          "id",
          "target",
          "status",
          "producerEvidence",
          "enforced",
          "required"
        ],
        "additionalProperties": false
      },
      "minItems": 0
    },
    "artifacts": {
      "type": "array",
      "items": {
        "$ref": "#/$defs/artifact"
      },
      "minItems": 0
    },
    "reports": {
      "type": "array",
      "items": {
        "$ref": "#/$defs/report"
      },
      "minItems": 0
    },
    "evidence": {
      "type": "array",
      "items": {
        "$ref": "#/$defs/evidence"
      },
      "minItems": 0
    },
    "diagnostics": {
      "type": "array",
      "items": {
        "$ref": "#/$defs/diagnostic"
      },
      "minItems": 0
    },
    "extensions": {
      "type": "object",
      "propertyNames": {
        "pattern": "^[a-z0-9.-]+/[A-Za-z0-9._-]+$"
      },
      "additionalProperties": true
    },
    "envelopePath": {
      "$ref": "#/$defs/path"
    },
    "envelopeDigest": {
      "type": "string",
      "pattern": "^sha256:[0-9a-f]{64}$"
    }
  },
  "required": [
    "schemaVersion",
    "kind",
    "runId",
    "planDigest",
    "planPath",
    "status",
    "source",
    "targets",
    "actions",
    "artifacts",
    "reports",
    "evidence",
    "diagnostics",
    "envelopePath",
    "envelopeDigest"
  ],
  "additionalProperties": false,
  "$defs": {
    "artifact": {
      "type": "object",
      "properties": {
        "id": {
          "type": "string",
          "pattern": "^[A-Za-z0-9][A-Za-z0-9_.:/-]{0,255}$"
        },
        "target": {
          "type": "string",
          "pattern": "^[A-Za-z0-9][A-Za-z0-9_.:/-]{0,255}$"
        },
        "variant": {
          "type": "object",
          "additionalProperties": {
            "type": "string"
          }
        },
        "name": {
          "type": "string",
          "pattern": "^[A-Za-z][A-Za-z0-9_-]{0,63}$"
        },
        "producer": {
          "type": "string",
          "pattern": "^[A-Za-z0-9][A-Za-z0-9_.:/-]{0,255}$"
        },
        "kind": {
          "enum": [
            "file",
            "directory",
            "oci-image",
            "oci-index",
            "chart"
          ]
        },
        "version": {
          "type": "string",
          "minLength": 1
        },
        "mediaType": {
          "type": "string",
          "minLength": 1
        },
        "path": {
          "type": "string",
          "pattern": "^(?!/)(?!.*(?:^|/)\\.\\.(?:/|$))(?!.*[\\\\:])[^\\x00-\\x1f]+$"
        },
        "digest": {
          "type": "string",
          "pattern": "^sha256:[0-9a-f]{64}$"
        },
        "size": {
          "type": "integer",
          "minimum": 0,
          "maximum": 9007199254740991
        },
        "ociDigest": {
          "type": "string",
          "pattern": "^sha256:[0-9a-f]{64}$"
        }
      },
      "required": [
        "id",
        "target",
        "variant",
        "name",
        "producer",
        "kind",
        "version",
        "mediaType",
        "path",
        "digest",
        "size"
      ],
      "additionalProperties": false
    },
    "diagnostic": {
      "type": "object",
      "properties": {
        "code": {
          "type": "string",
          "minLength": 1
        },
        "phase": {
          "type": "string",
          "minLength": 1
        },
        "severity": {
          "enum": [
            "info",
            "warning",
            "error"
          ]
        },
        "message": {
          "type": "string",
          "minLength": 1
        },
        "target": {
          "type": "string",
          "pattern": "^[A-Za-z0-9][A-Za-z0-9_.:/-]{0,255}$"
        },
        "action": {
          "type": "string",
          "pattern": "^[A-Za-z0-9][A-Za-z0-9_.:/-]{0,255}$"
        }
      },
      "required": [
        "code",
        "phase",
        "severity",
        "message"
      ],
      "additionalProperties": false
    },
    "evidence": {
      "type": "object",
      "properties": {
        "id": {
          "type": "string",
          "pattern": "^[A-Za-z0-9][A-Za-z0-9_.:/-]{0,255}$"
        },
        "kind": {
          "type": "string",
          "minLength": 1
        },
        "subjectDigest": {
          "type": "string",
          "pattern": "^sha256:[0-9a-f]{64}$"
        },
        "producer": {
          "type": "string",
          "pattern": "^[A-Za-z0-9][A-Za-z0-9_.:/-]{0,255}$"
        },
        "verification": {
          "enum": [
            "unverified",
            "verified",
            "local"
          ]
        },
        "path": {
          "type": "string",
          "pattern": "^(?!/)(?!.*(?:^|/)\\.\\.(?:/|$))(?!.*[\\\\:])[^\\x00-\\x1f]+$"
        },
        "digest": {
          "type": "string",
          "pattern": "^sha256:[0-9a-f]{64}$"
        }
      },
      "required": [
        "id",
        "kind",
        "subjectDigest",
        "producer",
        "verification"
      ],
      "additionalProperties": false
    },
    "path": {
      "type": "string",
      "pattern": "^(?!/)(?!.*(?:^|/)\\.\\.(?:/|$))(?!.*[\\\\:])[^\\x00-\\x1f]+$"
    },
    "platform": {
      "type": "object",
      "properties": {
        "os": {
          "enum": [
            "linux",
            "windows",
            "darwin"
          ]
        },
        "arch": {
          "type": "string",
          "minLength": 1
        },
        "abi": {
          "type": "string",
          "minLength": 1
        },
        "runtime": {
          "type": "string",
          "minLength": 1
        },
        "emulation": {
          "type": "boolean"
        }
      },
      "required": [
        "os",
        "arch"
      ],
      "additionalProperties": false
    },
    "report": {
      "type": "object",
      "properties": {
        "id": {
          "type": "string",
          "pattern": "^[A-Za-z0-9][A-Za-z0-9_.:/-]{0,255}$"
        },
        "action": {
          "type": "string",
          "pattern": "^[A-Za-z0-9][A-Za-z0-9_.:/-]{0,255}$"
        },
        "target": {
          "type": "string",
          "pattern": "^[A-Za-z0-9][A-Za-z0-9_.:/-]{0,255}$"
        },
        "kind": {
          "enum": [
            "test",
            "coverage",
            "scan",
            "sbom",
            "lint",
            "format"
          ]
        },
        "format": {
          "type": "string",
          "minLength": 1
        },
        "status": {
          "enum": [
            "collected",
            "not-detected",
            "unsupported",
            "disabled",
            "missing",
            "invalid"
          ]
        },
        "path": {
          "type": "string",
          "pattern": "^(?!/)(?!.*(?:^|/)\\.\\.(?:/|$))(?!.*[\\\\:])[^\\x00-\\x1f]+$"
        },
        "digest": {
          "type": "string",
          "pattern": "^sha256:[0-9a-f]{64}$"
        },
        "subjectDigest": {
          "type": "string",
          "pattern": "^sha256:[0-9a-f]{64}$"
        },
        "summary": {
          "type": "object",
          "properties": {
            "passed": {
              "type": "integer",
              "minimum": 0,
              "maximum": 9007199254740991
            },
            "failed": {
              "type": "integer",
              "minimum": 0,
              "maximum": 9007199254740991
            },
            "skipped": {
              "type": "integer",
              "minimum": 0,
              "maximum": 9007199254740991
            },
            "total": {
              "type": "integer",
              "minimum": 0,
              "maximum": 9007199254740991
            },
            "covered": {
              "type": "integer",
              "minimum": 0,
              "maximum": 9007199254740991
            },
            "metric": {
              "type": "string",
              "minLength": 1
            }
          },
          "required": [],
          "additionalProperties": false
        }
      },
      "required": [
        "id",
        "action",
        "target",
        "kind",
        "format",
        "status",
        "summary"
      ],
      "additionalProperties": false
    },
    "source": {
      "type": "object",
      "properties": {
        "treeDigest": {
          "type": "string",
          "pattern": "^sha256:[0-9a-f]{64}$"
        },
        "commit": {
          "type": [
            "string",
            "null"
          ]
        },
        "dirty": {
          "type": "boolean"
        },
        "repository": {
          "type": "string",
          "minLength": 1
        }
      },
      "required": [
        "treeDigest",
        "commit",
        "dirty"
      ],
      "additionalProperties": false
    },
    "target": {
      "type": "object",
      "properties": {
        "id": {
          "type": "string",
          "pattern": "^[A-Za-z0-9][A-Za-z0-9_.:/-]{0,255}$"
        },
        "builder": {
          "type": "string",
          "minLength": 1
        },
        "builderDigest": {
          "type": "string",
          "pattern": "^sha256:[0-9a-f]{64}$"
        },
        "path": {
          "type": "string",
          "pattern": "^(?!/)(?!.*(?:^|/)\\.\\.(?:/|$))(?!.*[\\\\:])[^\\x00-\\x1f]+$"
        },
        "variant": {
          "type": "object",
          "additionalProperties": {
            "type": "string"
          }
        },
        "platform": {
          "$ref": "#/$defs/platform"
        },
        "extensions": {
          "type": "object",
          "propertyNames": {
            "pattern": "^[a-z0-9.-]+/[A-Za-z0-9._-]+$"
          },
          "additionalProperties": true
        }
      },
      "required": [
        "id",
        "builder",
        "builderDigest",
        "path",
        "variant",
        "platform"
      ],
      "additionalProperties": false
    }
  }
}
